<?xml version="1.0" encoding="utf-8"?>
<collection xmlns="http://www.cote.com.au/xml/recipes" xmlns:xsi="http://www.w3.org/2001/XMLSchema-instance" xsi:schemaLocation="http://www.cote.com.au/xml/recipes recipe-schema.xsd">
	<description>This is a Persian recipe</description>
	<recipes>
		<recipe>
			<id>Top1</id>
			<title>Qorme Sabzi(stew)</title>
			<date>Fri, 28 May 04</date>
			<ingredients>
				<ingredient>
					<name>Fried Vegtables</name>
					<ingredients>
						<ingredient>
							<name>mixed persian vegtables</name>
							<ingredients>
								<ingredient>
									<name>parsley</name>
									<amount>100</amount>
									<unit>grams</unit>
								</ingredient>
								<ingredient>
									<name>coriander</name>
									<amount>100</amount>
									<unit>grams</unit>
								</ingredient>
								<ingredient>
									<name>fungreek</name>
									<amount>50</amount>
									<unit>grams</unit>
								</ingredient>
								<ingredient>
									<name>persian leek</name>
									<amount>100</amount>
									<unit>grams</unit>
								</ingredient>
								<ingredient>
									<name>spinach</name>
									<amount>50</amount>
									<unit>grams</unit>
								</ingredient>
							</ingredients>
							<preparation>
								<step>Dice all vegtables together</step>
								<step>Put olive intho the pan</step>
								<step>Let the oil get hot</step>
								<step>Put vegtables into the hot oil on the low heat</step>
								<step>let them boil until their colour chenge a bit</step>
							</preparation>
						</ingredient>
					</ingredients>
				</ingredient>
				<ingredient>
					<name>lamb diced</name>
					<amount>300</amount>
					<unit>grams</unit>
				</ingredient>
				<ingredient>
					<name>onion</name>
					<amount>1</amount>
				</ingredient>
				<ingredient>
					<name>red beens</name>
					<amount>200</amount>
					<unit>grams</unit>
				</ingredient>
				<ingredient>
					<name>dried lime</name>
					<amount>3</amount>
				</ingredient>
				<ingredient>
					<name>turmeric</name>
					<amount>1.5</amount>
					<unit>tea spoon</unit>
				</ingredient>
				<ingredient>
					<name>salt</name>
					<amount>2</amount>
					<unit>tea spoon</unit>
				</ingredient>
				<ingredient>
					<name>water</name>
					<amount>2</amount>
					<unit>cups</unit>
				</ingredient>
				<ingredient>
					<name>rice</name>
					<amount>3</amount>
					<unit>cups</unit>
				</ingredient>
			</ingredients>
			<preparation>
				<step>Dice onion and put it in hot extra olive oil until it gets a caramelise colour</step>
				<step>Add turmaric to them</step>
				<step>Add meat and red beens to the onions</step>
				<step>Add water to the ingredients and let them boil slowly for 1.5 hours</step>
				<step>Add vegtables,dried limes, salt to your dish</step>
				<step>Let all ingredients boil for another 1 hour </step>
				<step>Make the rice as usuall. When the stew is ready you can have it with the rice and 
             have some persian salad or yoghurt beside your "Qorme Sabzi"</step>
			</preparation>
			<comment>Qorme Sabzi is one of the most delisious Persian foods that everyone should try it</comment>
			<nutrition>
				<calories>3520</calories>
				<fat>66%</fat>
			</nutrition>
			<related ref="QS">this goes very well with persian salad or yoghurt</related>
		</recipe>
	</recipes>
</collection>
